{
  "$schema": "http://json-schema.org/draft-07/schema#",
  "$id": "https://github.com/alibnali/ADAM/schemas/DesignCodeEntry.json",
  "title": "DesignCodeEntry",
  "description": "A single design code entry in the ADAM Design Code Registry.",
  "type": "object",
  "required": ["code_id", "name", "edition", "discipline", "region", "unit_system", "parameters"],
  "additionalProperties": false,
  "properties": {
    "code_id":     { "type": "string", "pattern": "^[A-Z0-9_-]+$" },
    "name":        { "type": "string" },
    "edition":     { "type": "string" },
    "discipline":  { "type": "string", "enum": ["structural", "architectural", "civil", "mep", "geotechnical", "general"] },
    "region":      { "type": "string" },
    "unit_system": { "type": "string", "enum": ["SI", "Imperial", "both"] },
    "parameters":  { "type": "object", "additionalProperties": true },
    "notes":       { "type": "string" },
    "supported":   { "type": "boolean", "default": false }
  }
}
