[
  {
    "code_id": "ACI_318_19",
    "name": "ACI 318-19: Building Code Requirements for Structural Concrete",
    "edition": "2019",
    "discipline": "structural",
    "region": "USA / Middle East",
    "unit_system": "both",
    "supported": true,
    "parameters": {
      "phi_flexure": 0.90,
      "phi_shear": 0.75,
      "phi_compression_tied": 0.65,
      "phi_compression_spiral": 0.75,
      "phi_bearing": 0.65,
      "phi_torsion": 0.75,
      "lambda_normal_weight": 1.00,
      "lambda_lightweight": 0.75,
      "min_cover_footing_mm": 75,
      "min_cover_column_mm": 40,
      "min_cover_beam_mm": 40,
      "min_cover_slab_mm": 20,
      "min_cover_wall_mm": 20,
      "rho_min_flexure": 0.0018,
      "rho_max_flexure": 0.0206,
      "beta1_fc25": 0.85,
      "beta1_fc30": 0.83,
      "beta1_fc35": 0.81,
      "load_combo_strength_1": "1.2D + 1.6L",
      "load_combo_strength_2": "1.4D",
      "punching_shear_vc_coeff": 0.33
    },
    "notes": "Default code for all structural elements unless overridden in request."
  },
  {
    "code_id": "EC2_2004",
    "name": "EN 1992-1-1:2004 Eurocode 2: Design of Concrete Structures",
    "edition": "2004",
    "discipline": "structural",
    "region": "EU / International",
    "unit_system": "SI",
    "supported": true,
    "parameters": {
      "gamma_c": 1.50,
      "gamma_s": 1.15,
      "alpha_cc": 1.00,
      "min_cover_cmin_dur_xc1": 15,
      "min_cover_cmin_dur_xc2": 25,
      "min_cover_cmin_dur_xc3": 30,
      "min_cover_cmin_dur_xc4": 40,
      "delta_cdev": 10,
      "rho_min_flexure": 0.0013,
      "lambda_factor": 0.80,
      "eta_factor": 1.00,
      "load_combo_persistent": "1.35*Gk + 1.5*Qk",
      "punching_vrd_c_coeff": 0.18
    },
    "notes": "NDPs may override these values per national annex."
  },
  {
    "code_id": "BS_8110_1997",
    "name": "BS 8110-1:1997 Structural Use of Concrete",
    "edition": "1997",
    "discipline": "structural",
    "region": "UK / Former British Commonwealth",
    "unit_system": "SI",
    "supported": true,
    "parameters": {
      "gamma_c": 1.50,
      "gamma_s": 1.05,
      "min_cover_mild_mm": 25,
      "min_cover_moderate_mm": 35,
      "min_cover_severe_mm": 40,
      "min_cover_very_severe_mm": 50,
      "rho_min_flexure": 0.0013,
      "load_combo_uls": "1.4*Gk + 1.6*Qk",
      "vc_coeff": 0.79,
      "k1": 1.25
    },
    "notes": "Legacy code. Use EC2 for new UK projects post-2010."
  },
  {
    "code_id": "SBC_304_2018",
    "name": "SBC 304: Saudi Building Code \u2014 Concrete Structures",
    "edition": "2018",
    "discipline": "structural",
    "region": "Saudi Arabia",
    "unit_system": "SI",
    "supported": true,
    "parameters": {
      "phi_flexure": 0.90,
      "phi_shear": 0.75,
      "phi_compression_tied": 0.65,
      "phi_compression_spiral": 0.75,
      "phi_bearing": 0.65,
      "min_cover_footing_mm": 75,
      "min_cover_column_mm": 40,
      "min_cover_beam_mm": 40,
      "min_cover_slab_mm": 20,
      "rho_min_flexure": 0.0018,
      "load_combo_strength_1": "1.2D + 1.6L",
      "load_combo_strength_2": "1.4D",
      "punching_shear_vc_coeff": 0.33
    },
    "notes": "SBC 304 is largely aligned with ACI 318-19. Regional exposure classes apply for cover."
  },
  {
    "code_id": "IBC_2021",
    "name": "International Building Code 2021",
    "edition": "2021",
    "discipline": "general",
    "region": "Global / USA",
    "unit_system": "both",
    "supported": false,
    "parameters": {},
    "notes": "Planned for Phase 04. IBC references ACI 318 for concrete design."
  },
  {
    "code_id": "AASHTO_LRFD_9",
    "name": "AASHTO LRFD Bridge Design Specifications 9th Edition",
    "edition": "2020",
    "discipline": "civil",
    "region": "USA",
    "unit_system": "both",
    "supported": false,
    "parameters": {},
    "notes": "Planned for Phase 04 civil expansion."
  },
  {
    "code_id": "ACI_350_06",
    "name": "ACI 350-06: Code Requirements for Environmental Engineering Concrete Structures",
    "edition": "2006",
    "discipline": "civil",
    "region": "USA / Global",
    "unit_system": "both",
    "supported": false,
    "parameters": {},
    "notes": "Planned for Phase 04 civil expansion (water tanks, retaining walls)."
  }
]
